{
  "$schema": "https://json-schema.org/draft/2020-12/schema",
  "$id": "https://themoonpeople.dev/moonmod/manifest-v1.schema.json",
  "title": "MoonFactory manifest v1",
  "type": "object",
  "additionalProperties": false,
  "required": ["schema_version", "id", "name", "version", "framework_api", "games", "entry"],
  "properties": {
    "schema_version": {"const": 1},
    "id": {"type": "string", "pattern": "^[a-z0-9][a-z0-9._-]{2,63}$"},
    "name": {"type": "string", "minLength": 1, "maxLength": 96},
    "version": {"type": "string", "pattern": "^[0-9]+\\.[0-9]+\\.[0-9]+([+-][a-zA-Z0-9.-]+)?$"},
    "author": {"type": "string", "maxLength": 96},
    "description": {"type": "string", "maxLength": 1024},
    "framework_api": {"type": "integer", "minimum": 1},
    "games": {"type": "array", "minItems": 1, "maxItems": 2, "uniqueItems": true, "items": {"enum": ["chronicle", "chronicle-two"]}},
    "entry": {"type": "string", "maxLength": 128},
    "dependencies": {"type": "array", "maxItems": 64, "items": {"type": "string", "pattern": "^[a-z0-9][a-z0-9._-]{2,63}$"}, "uniqueItems": true},
    "load_after": {"type": "array", "maxItems": 64, "items": {"type": "string", "pattern": "^[a-z0-9][a-z0-9._-]{2,63}$"}, "uniqueItems": true},
    "load_before": {"type": "array", "maxItems": 64, "items": {"type": "string", "pattern": "^[a-z0-9][a-z0-9._-]{2,63}$"}, "uniqueItems": true},
    "permissions": {"type": "array", "maxItems": 64, "items": {"enum": ["storage.read", "storage.write", "game.read", "game.write", "content.register", "scripts.override", "debug.inspect", "native.extension"]}, "uniqueItems": true},
    "native_extension": {
      "type": "object",
      "additionalProperties": false,
      "required": ["library"],
      "properties": {
        "library": {"type": "string", "minLength": 1, "maxLength": 192, "description": "Package-relative .dll, .so, or .dylib library path; requires native.extension permission and explicit local trust."}
      }
    },
    "settings": {
      "type": "array",
      "items": {
        "type": "object",
        "additionalProperties": false,
        "required": ["id", "name", "type", "default"],
        "properties": {
          "id": {"type": "string", "pattern": "^[a-z][a-z0-9._-]{0,63}$"},
          "name": {"type": "string", "minLength": 1, "maxLength": 96},
          "description": {"type": "string", "maxLength": 512},
          "type": {"enum": ["boolean", "integer", "number", "string", "choice"]},
          "default": {},
          "min": {"type": "number"},
          "max": {"type": "number"},
          "step": {"type": "number", "exclusiveMinimum": 0},
          "choices": {"type": "array", "minItems": 1, "maxItems": 32, "items": {"type": "string", "maxLength": 96}}
        }
      }
    }
  },
  "allOf": [
    {"if": {"required": ["native_extension"]}, "then": {"properties": {"permissions": {"contains": {"const": "native.extension"}}}}},
    {"if": {"required": ["permissions"], "properties": {"permissions": {"contains": {"const": "native.extension"}}}}, "then": {"required": ["native_extension"]}}
  ]
}
