{
  "schema_version": 1,
  "id": "moonmod.hub",
  "name": "MoonMod Hub",
  "version": "1.1.0",
  "author": "Jeffiest",
  "description": "Quick links to the integrated progression, dungeon, controls, autosave and Gauntlet pages in the MoonFactory Mod Manager.",
  "framework_api": 1,
  "games": ["chronicle"],
  "entry": "main.lua",
  "permissions": ["game.read", "game.write", "content.register"]
}
