{
  "schema_version": 1,
  "id": "moonfactory.retail-dungeon-probe",
  "name": "MoonFactory Retail Dungeon Probe",
  "version": "1.0.0",
  "author": "MoonFactory",
  "description": "Retail-data proof that a Lua mod can register and enter an appended native-backed dungeon floor.",
  "framework_api": 1,
  "games": ["chronicle"],
  "entry": "main.lua",
  "permissions": ["content.register", "game.read", "game.write"]
}
