{
  "schema_version": 1,
  "id": "moonmod.weapon-mastery",
  "name": "Weapon Mastery Migration",
  "version": "1.1.0",
  "author": "Jeffiest",
  "description": "One-time import bridge for saves from the former standalone mastery mod; gameplay now lives in Ascension.",
  "framework_api": 1,
  "games": ["chronicle"],
  "entry": "main.lua",
  "dependencies": ["moonmod.ascension"],
  "permissions": ["game.read", "game.write", "content.register", "storage.read", "storage.write"]
}

